{
  "schemaVersion": "1.0.0",
  "suite": "Audrey browser launch results",
  "capturedAt": "2026-05-13",
  "plan": "docs/paper/browser-launch-plan.json",
  "targets": [
    {
      "id": "arxiv-preprint",
      "platform": "arxiv",
      "status": "pending",
      "publicUrl": null,
      "artifactUrl": "https://paper-site-r3jdakujn-evilanders-projects.vercel.app",
      "submittedAt": null,
      "operatorVerified": false,
      "manualRuleCheckCompleted": true,
      "postSubmitChecksCompleted": [],
      "blocker": "arXiv accepted the paper as submit/7591154, but the account page currently shows status on hold, so no public arXiv identifier or public abstract URL has been assigned yet.",
      "notes": "arXiv support confirmed the active username is Evilands and suspended the duplicate account. The active account was recovered, START NEW SUBMISSION appeared, the verified source package was uploaded, arXiv TeX Live 2025 compiled main.tex to a 34-page PDF successfully, the PDF and HTML previews were opened, metadata was saved with primary category cs.AI and cross-list cs.CR, and the article was submitted on 2026-05-13. The account page first showed processing, then on hold after refresh; record the final public arXiv URL after moderation and announcement."
    },
    {
      "id": "hacker-news-show",
      "platform": "hacker-news",
      "status": "submitted",
      "publicUrl": "https://news.ycombinator.com/item?id=48123428",
      "artifactUrl": "https://paper-site-r3jdakujn-evilanders-projects.vercel.app",
      "submittedAt": "2026-05-13T10:44:16-05:00",
      "operatorVerified": true,
      "manualRuleCheckCompleted": true,
      "postSubmitChecksCompleted": [
        "Record the HN item URL.",
        "Stay available to answer questions in the thread without marketing language.",
        "Record the follow-up HN source/repo item URL."
      ],
      "blocker": null,
      "notes": "The logged-in Show HN route returned https://news.ycombinator.com/showlim and stated that Show HN submissions are temporarily restricted for this account. A neutral normal HN link submission was made instead through https://news.ycombinator.com/submit with title Audrey: Local-first pre-action memory control for AI agents and URL https://paper-site-r3jdakujn-evilanders-projects.vercel.app/. HN newest showed item 48123428 as 1 point by evilanders with edit/delete controls, confirming account ownership of the submission. The original item exposed no comment box and the HN edit screen only allowed title editing, so a follow-up source submission was posted with title Audrey: local-first memory guard for AI agents (source) and URL https://github.com/Evilander/Audrey at https://news.ycombinator.com/item?id=48123903."
    },
    {
      "id": "reddit-discussion",
      "platform": "reddit",
      "status": "submitted",
      "publicUrl": "https://www.reddit.com/r/ClaudeCode/comments/1tc3dhb/audrey_localfirst_memory_guard_for_claude_code/",
      "artifactUrl": "https://paper-site-r3jdakujn-evilanders-projects.vercel.app",
      "submittedAt": "2026-05-13T10:40:46-05:00",
      "operatorVerified": true,
      "manualRuleCheckCompleted": true,
      "postSubmitChecksCompleted": [
        "Record the Reddit post URL and selected subreddit.",
        "If removed, do not repost without moderator guidance or materially different context.",
        "Verify the original Reddit post body includes the GitHub repo URL.",
        "Verify every Audrey-specific Reddit marketing post, comment, and reply contains the GitHub repo URL."
      ],
      "blocker": null,
      "notes": "Submitted to r/ClaudeCode with Showcase flair after reading its current rules. The post discloses builder affiliation and cost, links the public paper/artifact preview plus the GitHub repo URL https://github.com/Evilander/Audrey, and avoids unsupported external Mem0/Zep score claims. A question about Audrey versus PreToolUse plus permissions.deny was answered with the explicit split between static deny rules and learned/contextual memory guards; that parent reply was edited to include the GitHub repo URL (https://old.reddit.com/r/ClaudeCode/comments/1tc3dhb/audrey_localfirst_memory_guard_for_claude_code/olla7zf/). A follow-up question about hook-rule conversion, semantic false positives, and blocked-action UX was answered with local GuardBench scope boundaries and the GitHub repo URL (https://old.reddit.com/r/ClaudeCode/comments/1tc3dhb/audrey_localfirst_memory_guard_for_claude_code/olln5u3/). Moriarty/Dangerous-Jelly2309's GuardBench expansion comment was answered with the repo URL and a priority order for retry-amplification, wrong-environment mutation, author-contradiction, undo-prior-fix, and schema-evolution-blindness (https://old.reddit.com/r/ClaudeCode/comments/1tc3dhb/audrey_localfirst_memory_guard_for_claude_code/olloc0z/). A later Moriarty follow-up about MILP timing, asymmetric false-block/false-allow costs, and structural recurrence under disguise was answered with the GitHub repo URL and GuardBench v2 framing (https://old.reddit.com/r/ClaudeCode/comments/1tc3dhb/audrey_localfirst_memory_guard_for_claude_code/olmj11t/). Earlier r/LocalLLaMA submission was removed by AutoModerator for insufficient subreddit karma (https://www.reddit.com/r/LocalLLaMA/comments/1tc0i6a/audrey_a_localfirst_memory_firewall_for_agents/), so no duplicate LocalLLaMA repost was attempted. Follow-up participation was posted without Audrey links or promo in r/LocalLLaMA (https://old.reddit.com/r/LocalLLaMA/comments/1tc1d3c/is_it_worth_getting_a_5090_for_my_needs/olkulwp/), r/ClaudeAI (https://old.reddit.com/r/ClaudeAI/comments/1tc1o81/i_built_skills_curator_a_contextaware_claude/olkuwsi/), r/ChatGPT (https://old.reddit.com/r/ChatGPT/comments/1tbfzs6/ive_been_customizing_codex_to_do_automated/olkv6fd/), r/codex (https://old.reddit.com/r/codex/comments/1tbyd5c/most_vibecoders_have_poor_project_management/olkvjy3/), r/VibeCodingSaaS (https://old.reddit.com/r/VibeCodingSaaS/comments/1tbf0x7/every_session_ends_with_a_10layer_audit_heres/olkvu31/), r/ClaudeCode memory/guard threads (https://old.reddit.com/r/ClaudeCode/comments/1tc1h7w/are_you_guys_actually_using_memory/olkz22s/ and https://old.reddit.com/r/ClaudeCode/comments/1tc2k1z/one_thumbsdown_stopped_my_claude_code_agent_from/oll34lg/), and an r/artificial agent-security thread (https://old.reddit.com/r/artificial/comments/1tc1570/built_a_tool_that_stops_ai_agents_from_being/oll6eke/). A later r/VibeCodingSaaS memory-freshness discussion explicitly mentioning Audrey was answered with the GitHub repo URL and the same pre-action/staleness framing (https://old.reddit.com/r/VibeCodingSaaS/comments/1tbf0x7/every_session_ends_with_a_10layer_audit_heres/olmj3zt/)."
    },
    {
      "id": "x-launch-thread",
      "platform": "x",
      "status": "pending",
      "publicUrl": null,
      "artifactUrl": "https://paper-site-r3jdakujn-evilanders-projects.vercel.app",
      "submittedAt": null,
      "operatorVerified": false,
      "manualRuleCheckCompleted": false,
      "postSubmitChecksCompleted": [],
      "blocker": "Awaiting logged-in X posting; this browser session was confirmed for arXiv, HN, Reddit, and LinkedIn, but not X.",
      "notes": "Public artifact URL is available; shorten the first post before posting because the current publication-pack X first post is 282/280 characters after URL reserve."
    },
    {
      "id": "linkedin-launch-post",
      "platform": "linkedin",
      "status": "submitted",
      "publicUrl": "https://www.linkedin.com/feed/update/urn:li:share:7460326224108638208/",
      "artifactUrl": "https://paper-site-r3jdakujn-evilanders-projects.vercel.app",
      "submittedAt": "2026-05-13T08:53:01-05:00",
      "operatorVerified": true,
      "manualRuleCheckCompleted": false,
      "postSubmitChecksCompleted": [
        "Record the LinkedIn post URL.",
        "Verify the preview points at the public paper or repo URL.",
        "Verify the LinkedIn thread includes the GitHub repo URL."
      ],
      "blocker": null,
      "notes": "LinkedIn reported Post successful and exposes the post at the recorded update URL; the published post contains the Audrey launch text and LinkedIn's shortened outbound link for the public paper URL. A follow-up comment was posted on the same LinkedIn update with the GitHub repo URL https://github.com/Evilander/Audrey."
    }
  ]
}
